{
  "schema_id": "https://wrkr.dev/schemas/v1/report/action-contract-packet.schema.json",
  "schema_version": "1",
  "packet_id": "pacpkt-0ebdaf43a4d44bf3",
  "template": "action-contract-packet",
  "section_order": [
    "identity",
    "path",
    "authority_requirements",
    "credential_posture",
    "readiness_checks",
    "effects",
    "confirmation_approval",
    "compensation",
    "evidence_gaps",
    "lifecycle_observations",
    "next_step"
  ],
  "identity": {
    "artifact_id": "paca-e2e7e6219b8724da",
    "contract_id": "pac-50542afe4a40d384",
    "contract_family_id": "pacf-4eb827fcc0c1ca88",
    "contract_content_digest": "sha256:44598c0d850df0ffdbc3898ed2725593ebd61af5c704079e0d313ddc5f60af02",
    "canonical_content_digest": "sha256:e2e7e6219b8724dac32e3afdc2a8aa1cc44c9d4407af980b0f21a33c9d971415",
    "contract_version": "3",
    "revision": 1,
    "share_profile": "internal",
    "redacted": false,
    "source_scan_refs": [
      "saved_scan:v1"
    ],
    "creation_evidence": [
      "wch-bd1e152cd6ba",
      "wch-e09776c197c7"
    ]
  },
  "path": {
    "composition_id": "cap-1c42e101ce243ce9",
    "pattern_id": "workflow_mutation_to_production",
    "resolution_key": "rk-7533d64fd40943a1+rk-843baf1b21135736",
    "path_ids": [
      "apc-49d0b638e7b5",
      "apc-4b1b72ce2c70"
    ],
    "target": "built_in:deploy_workflow+built_in:kubernetes+built_in:release_automation",
    "target_class": "production_impacting",
    "outcome_class": "production_mutation",
    "stages": [
      {
        "stage_id": "cas-724be5488c20c42d",
        "role": "transform",
        "tool_type": "ci_agent",
        "location": ".github/workflows/release.yml",
        "action_classes": [
          "credential_access",
          "deploy",
          "execute",
          "read",
          "write"
        ],
        "target_class": "production_impacting",
        "evidence_state": "unknown",
        "freshness_state": "unknown"
      },
      {
        "stage_id": "cas-ab465825ec2b08e4",
        "role": "privileged_sink",
        "tool_type": "skill",
        "location": ".agents/skills/release/SKILL.md",
        "action_classes": [
          "deploy",
          "execute",
          "read",
          "write"
        ],
        "target_class": "production_impacting",
        "evidence_state": "unknown",
        "freshness_state": "unknown"
      }
    ]
  },
  "affected_asset": "built_in:deploy_workflow+built_in:kubernetes+built_in:release_automation",
  "authority_requirements": [
    {
      "requirement_id": "pacr-0fd5587f1b76b96b",
      "kind": "affected_system_owner",
      "required_constraint": "affected_system_owner:required",
      "observed_value": "owner:system:@local/demo",
      "evidence_state": "unknown",
      "freshness_state": "unknown",
      "evidence_refs": [
        ".gait/policy.yaml",
        "approval_status=unapproved",
        "authority_standing:true",
        "baseline:discovered_surface",
        "binding_subject:cloud_admin_key",
        "binding_subject:workflow_kubernetes_deploy",
        "credential_access:true",
        "credential_likely_scope:cloud_or_infra_access"
      ],
      "reason_codes": [
        "authority:affected_system_owner:unknown"
      ]
    },
    {
      "requirement_id": "pacr-33bf1a5bf122d5eb",
      "kind": "business_owner",
      "required_constraint": "business_owner:required",
      "evidence_state": "unknown",
      "freshness_state": "unknown",
      "evidence_refs": [
        ".gait/policy.yaml",
        "approval_status=unapproved",
        "authority_standing:true",
        "baseline:discovered_surface",
        "binding_subject:cloud_admin_key",
        "binding_subject:workflow_kubernetes_deploy",
        "credential_access:true",
        "credential_likely_scope:cloud_or_infra_access"
      ],
      "reason_codes": [
        "authority:business_owner:missing",
        "authority:business_owner:unknown"
      ]
    },
    {
      "requirement_id": "pacr-410f227306c79846",
      "kind": "credential_subject_constraint",
      "required_constraint": "credential_subject:required",
      "observed_value": "binding_subject:cloud_admin_key,binding_subject:workflow_kubernetes_deploy,provenance_subject:broad_pat,provenance_subject:cloud_admin_key",
      "evidence_state": "unknown",
      "freshness_state": "unknown",
      "evidence_refs": [
        ".gait/policy.yaml",
        "approval_status=unapproved",
        "authority_standing:true",
        "baseline:discovered_surface",
        "binding_subject:cloud_admin_key",
        "binding_subject:workflow_kubernetes_deploy",
        "credential_access:true",
        "credential_likely_scope:cloud_or_infra_access"
      ],
      "reason_codes": [
        "authority:credential_subject_constraint:unknown"
      ]
    },
    {
      "requirement_id": "pacr-eb17bcbffc40e5ca",
      "kind": "delegation_root",
      "required_constraint": "delegation_root:required",
      "observed_value": "authority-bfc23b0d135943e8",
      "evidence_state": "unknown",
      "freshness_state": "unknown",
      "evidence_refs": [
        ".gait/policy.yaml",
        "approval_status=unapproved",
        "authority_standing:true",
        "baseline:discovered_surface",
        "binding_subject:cloud_admin_key",
        "binding_subject:workflow_kubernetes_deploy",
        "credential_access:true",
        "credential_likely_scope:cloud_or_infra_access"
      ],
      "reason_codes": [
        "authority:delegation_root:unknown"
      ]
    },
    {
      "requirement_id": "pacr-e46b5cbc297e991b",
      "kind": "originating_intent",
      "required_constraint": "originating_task_or_intent:required",
      "observed_value": "intent:release",
      "evidence_state": "unknown",
      "freshness_state": "unknown",
      "evidence_refs": [
        ".gait/policy.yaml",
        "approval_status=unapproved",
        "authority_standing:true",
        "baseline:discovered_surface",
        "binding_subject:cloud_admin_key",
        "binding_subject:workflow_kubernetes_deploy",
        "credential_access:true",
        "credential_likely_scope:cloud_or_infra_access"
      ],
      "reason_codes": [
        "authority:originating_intent:unknown"
      ]
    },
    {
      "requirement_id": "pacr-5a0910fd7439cf1b",
      "kind": "permitted_agent_role",
      "required_constraint": "permitted_agent_role:required",
      "evidence_state": "unknown",
      "freshness_state": "unknown",
      "evidence_refs": [
        ".gait/policy.yaml",
        "approval_status=unapproved",
        "authority_standing:true",
        "baseline:discovered_surface",
        "binding_subject:cloud_admin_key",
        "binding_subject:workflow_kubernetes_deploy",
        "credential_access:true",
        "credential_likely_scope:cloud_or_infra_access"
      ],
      "reason_codes": [
        "authority:permitted_agent_role:missing",
        "authority:permitted_agent_role:unknown"
      ]
    },
    {
      "requirement_id": "pacr-b4bd4488ef220fa3",
      "kind": "policy_authority",
      "required_constraint": "policy_authority:required",
      "observed_value": "policy:gait://release-control",
      "evidence_state": "unknown",
      "freshness_state": "unknown",
      "evidence_refs": [
        ".gait/policy.yaml",
        "approval_status=unapproved",
        "authority_standing:true",
        "baseline:discovered_surface",
        "binding_subject:cloud_admin_key",
        "binding_subject:workflow_kubernetes_deploy",
        "credential_access:true",
        "credential_likely_scope:cloud_or_infra_access"
      ],
      "reason_codes": [
        "authority:policy_authority:unknown"
      ]
    },
    {
      "requirement_id": "pacr-76c6ec8873ba58c7",
      "kind": "requester_identity",
      "required_constraint": "requester_identity:required",
      "evidence_state": "unknown",
      "freshness_state": "unknown",
      "evidence_refs": [
        ".gait/policy.yaml",
        "approval_status=unapproved",
        "authority_standing:true",
        "baseline:discovered_surface",
        "binding_subject:cloud_admin_key",
        "binding_subject:workflow_kubernetes_deploy",
        "credential_access:true",
        "credential_likely_scope:cloud_or_infra_access"
      ],
      "reason_codes": [
        "authority:requester_identity:missing",
        "authority:requester_identity:unknown"
      ]
    },
    {
      "requirement_id": "pacr-23f423c27e33022c",
      "kind": "separation_of_duties",
      "required_constraint": "requester_must_not_approve",
      "evidence_state": "unknown",
      "freshness_state": "unknown",
      "evidence_refs": [
        ".gait/policy.yaml",
        "approval_status=unapproved",
        "authority_standing:true",
        "baseline:discovered_surface",
        "binding_subject:cloud_admin_key",
        "binding_subject:workflow_kubernetes_deploy",
        "credential_access:true",
        "credential_likely_scope:cloud_or_infra_access"
      ],
      "reason_codes": [
        "authority:separation_of_duties:missing",
        "authority:separation_of_duties:unknown"
      ]
    }
  ],
  "credential_posture": {
    "required_mode": "ephemeral",
    "requirement_ids": [
      "pacp-100f0b7bdd4a16b2",
      "pacr-410f227306c79846",
      "pacr-76c6ec8873ba58c7"
    ],
    "evidence_state": "contradictory",
    "freshness_state": "unknown",
    "activation_grant": false
  },
  "readiness_checks": [
    {
      "requirement_id": "pacp-100f0b7bdd4a16b2",
      "kind": "credential_mode",
      "required_constraint": "credential_mode:ephemeral",
      "observed_value": "standing",
      "observed_result": "standing",
      "acceptable_producers": [
        "credential_authority"
      ],
      "max_age": "PT24H",
      "evidence_state": "contradictory",
      "freshness_state": "unknown",
      "evidence_refs": [
        ".gait/policy.yaml",
        "approval_status=unapproved",
        "authority_standing:true",